film_id,title,description,release_year,language_id,rental_duration,rental_rate,length,replacement_cost,rating,last_update,special_features,fulltext
133,Chamber Italian,A Fateful Reflection of a Moose And a Husband who must Overcome a Monkey in Nigeria,2006,1,7,4.99,117,14.99,NC-17,2013-05-26 14:50:58.951,"[""Trailers""]",'chamber':1 'fate':4 'husband':11 'italian':2 'monkey':16 'moos':8 'must':13 'nigeria':18 'overcom':14 'reflect':5
384,Grosse Wonderful,A Epic Drama of a Cat And a Explorer who must Redeem a Moose in Australia,2006,1,5,4.99,49,19.99,R,2013-05-26 14:50:58.951,"[""Behind the Scenes""]",'australia':18 'cat':8 'drama':5 'epic':4 'explor':11 'gross':1 'moos':16 'must':13 'redeem':14 'wonder':2
8,Airport Pollock,A Epic Tale of a Moose And a Girl who must Confront a Monkey in Ancient India,2006,1,6,4.99,54,15.99,R,2013-05-26 14:50:58.951,"[""Trailers""]",'airport':1 'ancient':18 'confront':14 'epic':4 'girl':11 'india':19 'monkey':16 'moos':8 'must':13 'pollock':2 'tale':5
98,Bright Encounters,A Fateful Yarn of a Lumberjack And a Feminist who must Conquer a Student in A Jet Boat,2006,1,4,4.99,73,12.99,PG-13,2013-05-26 14:50:58.951,"[""Trailers""]",'boat':20 'bright':1 'conquer':14 'encount':2 'fate':4 'feminist':11 'jet':19 'lumberjack':8 'must':13 'student':16 'yarn':5
1,Academy Dinosaur,A Epic Drama of a Feminist And a Mad Scientist who must Battle a Teacher in The Canadian Rockies,2006,1,6,0.99,86,20.99,PG,2013-05-26 14:50:58.951,"[""Deleted Scenes"",""Behind the Scenes""]",'academi':1 'battl':15 'canadian':20 'dinosaur':2 'drama':5 'epic':4 'feminist':8 'mad':11 'must':14 'rocki':21 'scientist':12 'teacher':17
